{
  "$schema": "https://json-schema.org/draft/2020-12/schema",
  "$id": "https://farfield.dev/protocol/history/v1/record.schema.json",
  "title": "Farfield History Record v1",
  "type": "object",
  "required": [
    "schema_version",
    "id",
    "conversation_id",
    "kind",
    "occurred_at",
    "recorded_at",
    "tags",
    "content",
    "record_sha256"
  ],
  "properties": {
    "schema_version": {"const": "farfield.history.record.v1"},
    "id": {"type": "string", "minLength": 1, "maxLength": 255},
    "conversation_id": {"type": "string", "minLength": 1, "maxLength": 255},
    "kind": {"type": "string", "minLength": 1, "maxLength": 128},
    "occurred_at": {"type": "string", "format": "date-time"},
    "recorded_at": {"type": "string", "format": "date-time"},
    "sequence": {"type": ["integer", "null"], "minimum": 0},
    "trace_id": {"type": ["string", "null"]},
    "span_id": {"type": ["string", "null"]},
    "parent_id": {"type": ["string", "null"]},
    "agent": {"type": ["string", "null"]},
    "tool": {"type": ["string", "null"]},
    "status": {"type": ["string", "null"]},
    "tags": {"type": "object", "additionalProperties": {"type": "string"}},
    "content": {
      "type": "object",
      "required": ["sha256", "size", "media_type", "key"],
      "properties": {
        "sha256": {"type": "string", "pattern": "^[0-9a-f]{64}$"},
        "size": {"type": "integer", "minimum": 0},
        "media_type": {"type": "string"},
        "key": {"type": "string"}
      },
      "additionalProperties": false
    },
    "record_sha256": {"type": "string", "pattern": "^[0-9a-f]{64}$"}
  },
  "additionalProperties": false
}
