{
  "agent": "researcher",
  "content": {
    "key": "blobs/v1/sha256/f7/9545992db9ec4c529e2a5db41a8910f23d1d038778873c201cf2f30f82840e",
    "media_type": "application/json",
    "sha256": "f79545992db9ec4c529e2a5db41a8910f23d1d038778873c201cf2f30f82840e",
    "size": 32
  },
  "conversation_id": "conv_fixture",
  "id": "rec_fixture",
  "kind": "model.response",
  "occurred_at": "2026-08-19T12:00:00.123456Z",
  "parent_id": null,
  "recorded_at": "2026-08-19T12:00:01.123456Z",
  "record_sha256": "eb31b22ef919edff12f5a9a6be142bc11f54e609652059043753431622c18c56",
  "schema_version": "farfield.history.record.v1",
  "sequence": 7,
  "span_id": "span_fixture",
  "status": "completed",
  "tags": {"env": "test"},
  "tool": null,
  "trace_id": "trace_fixture"
}
